{
  "task_id": "test-task",
  "receipt_type": "contract",
  "status": "fail",
  "generated_at": "2026-03-06T08:54:59.863474",
  "checks": [
    {
      "name": "task_defined",
      "status": "fail"
    },
    {
      "name": "scope_valid",
      "status": "fail"
    }
  ],
  "state_before": "unknown",
  "state_after": "blocked"
}